{
  "schema_version": "m5_sweep_manifest_v1",
  "generated_at": "2026-03-03T13:50:16.778616",
  "profile": "m5",
  "git_sha": "acd0e21",
  "universe": "cta_top20",
  "dataset": "m2",
  "expected_seeds": [
    42,
    43,
    44
  ],
  "primary_metric": "pinball_loss.overall",
  "runs": [
    {
      "exp_id": "baseline",
      "seed": 42,
      "run_id": "38a265ee",
      "config_hash": "38411e79",
      "train_metrics_path": "reports/m5_baseline_seed42_train_metrics.json",
      "eval_metrics_path": "reports/m5_baseline_seed42_eval_metrics.json"
    },
    {
      "exp_id": "baseline",
      "seed": 43,
      "run_id": "e2eb17a4",
      "config_hash": "38411e79",
      "train_metrics_path": "reports/m5_baseline_seed43_train_metrics.json",
      "eval_metrics_path": "reports/m5_baseline_seed43_eval_metrics.json"
    },
    {
      "exp_id": "baseline",
      "seed": 44,
      "run_id": "b6c00273",
      "config_hash": "38411e79",
      "train_metrics_path": "reports/m5_baseline_seed44_train_metrics.json",
      "eval_metrics_path": "reports/m5_baseline_seed44_eval_metrics.json"
    },
    {
      "exp_id": "no_clip",
      "seed": 42,
      "run_id": "356fca98",
      "config_hash": "736c9740",
      "train_metrics_path": "reports/m5_no_clip_seed42_train_metrics.json",
      "eval_metrics_path": "reports/m5_no_clip_seed42_eval_metrics.json"
    },
    {
      "exp_id": "no_clip",
      "seed": 43,
      "run_id": "b61aefa4",
      "config_hash": "736c9740",
      "train_metrics_path": "reports/m5_no_clip_seed43_train_metrics.json",
      "eval_metrics_path": "reports/m5_no_clip_seed43_eval_metrics.json"
    },
    {
      "exp_id": "no_clip",
      "seed": 44,
      "run_id": "27934f62",
      "config_hash": "736c9740",
      "train_metrics_path": "reports/m5_no_clip_seed44_train_metrics.json",
      "eval_metrics_path": "reports/m5_no_clip_seed44_eval_metrics.json"
    },
    {
      "exp_id": "batch_256",
      "seed": 42,
      "run_id": "9169f783",
      "config_hash": "f1d8a097",
      "train_metrics_path": "reports/m5_batch_256_seed42_train_metrics.json",
      "eval_metrics_path": "reports/m5_batch_256_seed42_eval_metrics.json"
    },
    {
      "exp_id": "batch_256",
      "seed": 43,
      "run_id": "cd01fa6c",
      "config_hash": "f1d8a097",
      "train_metrics_path": "reports/m5_batch_256_seed43_train_metrics.json",
      "eval_metrics_path": "reports/m5_batch_256_seed43_eval_metrics.json"
    },
    {
      "exp_id": "batch_256",
      "seed": 44,
      "run_id": "6e9bb758",
      "config_hash": "f1d8a097",
      "train_metrics_path": "reports/m5_batch_256_seed44_train_metrics.json",
      "eval_metrics_path": "reports/m5_batch_256_seed44_eval_metrics.json"
    },
    {
      "exp_id": "steps_1000",
      "seed": 42,
      "run_id": "83d1f207",
      "config_hash": "a25a1c8e",
      "train_metrics_path": "reports/m5_steps_1000_seed42_train_metrics.json",
      "eval_metrics_path": "reports/m5_steps_1000_seed42_eval_metrics.json"
    },
    {
      "exp_id": "steps_1000",
      "seed": 43,
      "run_id": "15de4235",
      "config_hash": "a25a1c8e",
      "train_metrics_path": "reports/m5_steps_1000_seed43_train_metrics.json",
      "eval_metrics_path": "reports/m5_steps_1000_seed43_eval_metrics.json",
      "train_run_md_path": "reports/m5_steps_1000_seed43_train_run.md",
      "eval_run_md_path": "reports/m5_steps_1000_seed43_eval_run.md"
    },
    {
      "exp_id": "steps_1000",
      "seed": 44,
      "run_id": "4b48b79b",
      "config_hash": "a25a1c8e",
      "train_metrics_path": "reports/m5_steps_1000_seed44_train_metrics.json",
      "eval_metrics_path": "reports/m5_steps_1000_seed44_eval_metrics.json",
      "train_run_md_path": "reports/m5_steps_1000_seed44_train_run.md",
      "eval_run_md_path": "reports/m5_steps_1000_seed44_eval_run.md"
    }
  ]
}